{
  "schemaVersion": "evaluation-suite.v1",
  "suiteId": "initial-coverage-36",
  "version": "1",
  "contentDigest": "sha256:d7c41459561aba38a3bfca4b0c26276262c6a8b7c94c0ec2ff6f09b6fc495a27",
  "title": "Initial 36-case evaluation-first coverage inventory",
  "purpose": "Inventory 36 disjointly partitioned synthetic scenarios across capture, identity, memory, trajectory, and governed action boundaries; this catalog is not itself a development slice.",
  "scenarios": [
    {
      "scenarioId": "TS-ACT-101",
      "revision": "1",
      "contentDigest": "sha256:bcc8029eb15c99262d46cb4b5b59224410174505917a4e7cb0d66806643bea1c",
      "lifecycle": "active",
      "adjudication": "unreviewed",
      "criterionAdjudicationDigest": "sha256:4f53cda18c2baa0c0354bb5f9a3ecbe5ed12ab4d8e11ba873c2f11161202b945",
      "partition": "dev",
      "dataClass": "synthetic_shareable"
    },
    {
      "scenarioId": "TS-ACT-102",
      "revision": "1",
      "contentDigest": "sha256:7047a47d652ede965c087c7e7bce5dca04b85191902288ca4f1db328ceb03edc",
      "lifecycle": "active",
      "adjudication": "unreviewed",
      "criterionAdjudicationDigest": "sha256:4f53cda18c2baa0c0354bb5f9a3ecbe5ed12ab4d8e11ba873c2f11161202b945",
      "partition": "p0",
      "dataClass": "synthetic_shareable"
    },
    {
      "scenarioId": "TS-ACT-103",
      "revision": "1",
      "contentDigest": "sha256:954a1531c5ac686bd773e937c1b6b445176c915845f812887152ec460572c688",
      "lifecycle": "active",
      "adjudication": "unreviewed",
      "criterionAdjudicationDigest": "sha256:4f53cda18c2baa0c0354bb5f9a3ecbe5ed12ab4d8e11ba873c2f11161202b945",
      "partition": "held_out",
      "dataClass": "synthetic_shareable"
    },
    {
      "scenarioId": "TS-ACT-104",
      "revision": "1",
      "contentDigest": "sha256:ad88406173f5e16514f6b4c693cd3195a3738343c55fec00648b9e2f66a56ff0",
      "lifecycle": "active",
      "adjudication": "unreviewed",
      "criterionAdjudicationDigest": "sha256:4f53cda18c2baa0c0354bb5f9a3ecbe5ed12ab4d8e11ba873c2f11161202b945",
      "partition": "held_out",
      "dataClass": "synthetic_shareable"
    },
    {
      "scenarioId": "TS-ACT-105",
      "revision": "1",
      "contentDigest": "sha256:a813af10b19331fe406809e22fc4d48028b045138e93ffc72ba6a85b50d6a9fc",
      "lifecycle": "active",
      "adjudication": "unreviewed",
      "criterionAdjudicationDigest": "sha256:4f53cda18c2baa0c0354bb5f9a3ecbe5ed12ab4d8e11ba873c2f11161202b945",
      "partition": "p0",
      "dataClass": "synthetic_restricted"
    },
    {
      "scenarioId": "TS-ACT-106",
      "revision": "1",
      "contentDigest": "sha256:1e7ede90b40291bfa3b802c9a23d69812562a2fd9ef0610cc226d947728e7a1e",
      "lifecycle": "active",
      "adjudication": "unreviewed",
      "criterionAdjudicationDigest": "sha256:4f53cda18c2baa0c0354bb5f9a3ecbe5ed12ab4d8e11ba873c2f11161202b945",
      "partition": "red_team",
      "dataClass": "synthetic_restricted"
    },
    {
      "scenarioId": "TS-ACT-107",
      "revision": "1",
      "contentDigest": "sha256:b3ecf4807d5b862b9abcd71a6c397a149861e28374527eb3350f4fd1fb3cb2ed",
      "lifecycle": "active",
      "adjudication": "unreviewed",
      "criterionAdjudicationDigest": "sha256:4f53cda18c2baa0c0354bb5f9a3ecbe5ed12ab4d8e11ba873c2f11161202b945",
      "partition": "dev",
      "dataClass": "synthetic_shareable"
    },
    {
      "scenarioId": "TS-ACT-108",
      "revision": "1",
      "contentDigest": "sha256:ee88625b0ad86da5127e95ddbb2abd67999692fb9a8ae1ad47f90f68c90be929",
      "lifecycle": "active",
      "adjudication": "unreviewed",
      "criterionAdjudicationDigest": "sha256:4f53cda18c2baa0c0354bb5f9a3ecbe5ed12ab4d8e11ba873c2f11161202b945",
      "partition": "p0",
      "dataClass": "synthetic_restricted"
    },
    {
      "scenarioId": "TS-CAP-001",
      "revision": "1",
      "contentDigest": "sha256:a1df66dc7f0b8cb071f4bc5b8c050c4202d997884ae3255cc8e4ec18cbec7a00",
      "lifecycle": "active",
      "adjudication": "unreviewed",
      "criterionAdjudicationDigest": "sha256:4f53cda18c2baa0c0354bb5f9a3ecbe5ed12ab4d8e11ba873c2f11161202b945",
      "partition": "dev",
      "dataClass": "synthetic_shareable"
    },
    {
      "scenarioId": "TS-CAP-002",
      "revision": "1",
      "contentDigest": "sha256:f7dfdc8a33132876c11a39a25e8c3d54b130654962b36f4ea45fd81501fe1626",
      "lifecycle": "active",
      "adjudication": "unreviewed",
      "criterionAdjudicationDigest": "sha256:4f53cda18c2baa0c0354bb5f9a3ecbe5ed12ab4d8e11ba873c2f11161202b945",
      "partition": "held_out",
      "dataClass": "synthetic_shareable"
    },
    {
      "scenarioId": "TS-CAP-003",
      "revision": "1",
      "contentDigest": "sha256:5b56786d0a26561ea799c0ab8779f599e96969fe4fdcb6d322af1d1dadbe2dad",
      "lifecycle": "active",
      "adjudication": "unreviewed",
      "criterionAdjudicationDigest": "sha256:4f53cda18c2baa0c0354bb5f9a3ecbe5ed12ab4d8e11ba873c2f11161202b945",
      "partition": "red_team",
      "dataClass": "synthetic_shareable"
    },
    {
      "scenarioId": "TS-CAP-004",
      "revision": "1",
      "contentDigest": "sha256:7b0a1411eb2b8a3b2d3a83bd360d4adc25c2dea6fbfa6f7d268f2a3a4aafeb4f",
      "lifecycle": "active",
      "adjudication": "unreviewed",
      "criterionAdjudicationDigest": "sha256:4f53cda18c2baa0c0354bb5f9a3ecbe5ed12ab4d8e11ba873c2f11161202b945",
      "partition": "p0",
      "dataClass": "synthetic_restricted"
    },
    {
      "scenarioId": "TS-CAP-005",
      "revision": "1",
      "contentDigest": "sha256:ac3631a3bb0255e770e087eac0aa3a64ef815960bbe2c0165a3f017f4c2f0bc7",
      "lifecycle": "active",
      "adjudication": "unreviewed",
      "criterionAdjudicationDigest": "sha256:4f53cda18c2baa0c0354bb5f9a3ecbe5ed12ab4d8e11ba873c2f11161202b945",
      "partition": "p0",
      "dataClass": "synthetic_restricted"
    },
    {
      "scenarioId": "TS-CAP-006",
      "revision": "1",
      "contentDigest": "sha256:6b70953eeea942a7f9a964bf903b2ba55c2834c92b958b27d7383e2f34ad1c2b",
      "lifecycle": "active",
      "adjudication": "unreviewed",
      "criterionAdjudicationDigest": "sha256:4f53cda18c2baa0c0354bb5f9a3ecbe5ed12ab4d8e11ba873c2f11161202b945",
      "partition": "p0",
      "dataClass": "synthetic_shareable"
    },
    {
      "scenarioId": "TS-ID-101",
      "revision": "1",
      "contentDigest": "sha256:0cfd10531cc7eee6228b27a36204f881c46f507638519a78191365da4bcb39f0",
      "lifecycle": "active",
      "adjudication": "unreviewed",
      "criterionAdjudicationDigest": "sha256:4f53cda18c2baa0c0354bb5f9a3ecbe5ed12ab4d8e11ba873c2f11161202b945",
      "partition": "dev",
      "dataClass": "synthetic_shareable"
    },
    {
      "scenarioId": "TS-ID-102",
      "revision": "1",
      "contentDigest": "sha256:01711d16f827cb2381c1143579889b31c37bfc5a69bcd9f00f959a317d1edf7a",
      "lifecycle": "active",
      "adjudication": "unreviewed",
      "criterionAdjudicationDigest": "sha256:4f53cda18c2baa0c0354bb5f9a3ecbe5ed12ab4d8e11ba873c2f11161202b945",
      "partition": "held_out",
      "dataClass": "synthetic_shareable"
    },
    {
      "scenarioId": "TS-ID-103",
      "revision": "1",
      "contentDigest": "sha256:ce7397e70a8bbdf128416d5b7f7d7bc4c743cc9d417cc48541563936072ca987",
      "lifecycle": "active",
      "adjudication": "unreviewed",
      "criterionAdjudicationDigest": "sha256:4f53cda18c2baa0c0354bb5f9a3ecbe5ed12ab4d8e11ba873c2f11161202b945",
      "partition": "p0",
      "dataClass": "synthetic_shareable"
    },
    {
      "scenarioId": "TS-ID-104",
      "revision": "1",
      "contentDigest": "sha256:8a3a7b9063a2e482bf4afcd30a2f72c114022e16214651a66313687bc9cf271c",
      "lifecycle": "active",
      "adjudication": "unreviewed",
      "criterionAdjudicationDigest": "sha256:4f53cda18c2baa0c0354bb5f9a3ecbe5ed12ab4d8e11ba873c2f11161202b945",
      "partition": "dev",
      "dataClass": "synthetic_shareable"
    },
    {
      "scenarioId": "TS-ID-105",
      "revision": "1",
      "contentDigest": "sha256:515a941cde012d81342665c5a8cd77aa5224b6817d65b4088ac08404f92fd18f",
      "lifecycle": "active",
      "adjudication": "unreviewed",
      "criterionAdjudicationDigest": "sha256:4f53cda18c2baa0c0354bb5f9a3ecbe5ed12ab4d8e11ba873c2f11161202b945",
      "partition": "red_team",
      "dataClass": "synthetic_shareable"
    },
    {
      "scenarioId": "TS-ID-106",
      "revision": "1",
      "contentDigest": "sha256:a9dc8a123c6cc18f7a05a5455f63740968cff613284e4b2e4a15e32a56870c23",
      "lifecycle": "active",
      "adjudication": "unreviewed",
      "criterionAdjudicationDigest": "sha256:4f53cda18c2baa0c0354bb5f9a3ecbe5ed12ab4d8e11ba873c2f11161202b945",
      "partition": "red_team",
      "dataClass": "synthetic_shareable"
    },
    {
      "scenarioId": "TS-ID-107",
      "revision": "1",
      "contentDigest": "sha256:d157c65848f616b177de1132b1715dc0034d2c322f61c3194ea1e69f86d9fcfe",
      "lifecycle": "active",
      "adjudication": "unreviewed",
      "criterionAdjudicationDigest": "sha256:4f53cda18c2baa0c0354bb5f9a3ecbe5ed12ab4d8e11ba873c2f11161202b945",
      "partition": "held_out",
      "dataClass": "synthetic_shareable"
    },
    {
      "scenarioId": "TS-ID-108",
      "revision": "1",
      "contentDigest": "sha256:cf4dfe8785cb74dd203897206fd46a0a9fdbaedf8c183bde8fd06892f6a708da",
      "lifecycle": "active",
      "adjudication": "unreviewed",
      "criterionAdjudicationDigest": "sha256:4f53cda18c2baa0c0354bb5f9a3ecbe5ed12ab4d8e11ba873c2f11161202b945",
      "partition": "red_team",
      "dataClass": "synthetic_shareable"
    },
    {
      "scenarioId": "TS-MEM-001",
      "revision": "1",
      "contentDigest": "sha256:8c074d1a061e7aa96b4c796950ef90f0b0f87d0256f4afc1d59f5b1b8fb5e2a8",
      "lifecycle": "active",
      "adjudication": "unreviewed",
      "criterionAdjudicationDigest": "sha256:4f53cda18c2baa0c0354bb5f9a3ecbe5ed12ab4d8e11ba873c2f11161202b945",
      "partition": "p0",
      "dataClass": "synthetic_shareable"
    },
    {